{
  "schema_version": 1,
  "date": "2026-10-09",
  "generated_at": "2026-10-09T08:01:06Z",
  "counts": {
    "launches": 5,
    "repos": 3,
    "news": 10,
    "hn": 10
  },
  "items": [
    {
      "id": "ph-openswarm-3-2026-10-09",
      "title": "OpenSwarm",
      "summary": "An agent-first desktop OS where swarms of agents drive apps and the browser in parallel on an infinite canvas, with the user directing tasks rather than doing them one at a time.",
      "url": "https://openswarm.info/",
      "source": "producthunt",
      "source_url": "https://www.producthunt.com/products/openswarm-3",
      "category": "launches",
      "tags": [
        "Agents",
        "Launch"
      ],
      "image": {
        "type": "logo",
        "url": "https://ph-files.imgix.net/ea2bfd22-7652-444c-b680-8028ef82bdc8.png?auto=format"
      },
      "signals": {
        "upvotes": 360,
        "comments": 59
      },
      "published_at": "2026-10-08T07:01:00Z",
      "hidden": false
    },
    {
      "id": "ph-openseo-2-2026-10-09",
      "title": "OpenSEO",
      "summary": "Open source Semrush alternative that exposes SEO data and tools to AI agents over MCP, plus new AI Visibility features for tracking how brands appear in AI answers.",
      "url": "https://openseo.so",
      "source": "producthunt",
      "source_url": "https://www.producthunt.com/products/openseo",
      "category": "launches",
      "tags": [
        "Open Source",
        "Agents",
        "MCP",
        "Launch"
      ],
      "image": {
        "type": "logo",
        "url": "https://ph-files.imgix.net/2c78fe4a-262c-48b2-a376-365b77bf6eeb.png?auto=format"
      },
      "signals": {
        "upvotes": 334,
        "comments": 36
      },
      "published_at": "2026-10-08T07:01:00Z",
      "hidden": false
    },
    {
      "id": "ph-claude-haiku-5-5-2026-10-09",
      "title": "Claude Haiku 5.5",
      "summary": "Anthropic's small model aimed at high-volume, cost-sensitive work: summarization, classification, coding subagents, customer support, and browser use.",
      "url": "https://www.anthropic.com/claude-haiku-5-5",
      "source": "producthunt",
      "source_url": "https://www.producthunt.com/products/claude-haiku-5-5",
      "category": "launches",
      "tags": [
        "Model Release",
        "LLM",
        "Anthropic",
        "Launch"
      ],
      "image": {
        "type": "logo",
        "url": "https://ph-files.imgix.net/3cb73165-14e8-4392-8199-fc53c9f20100.png?auto=format"
      },
      "signals": {
        "upvotes": 311,
        "comments": 7
      },
      "published_at": "2026-10-08T07:01:00Z",
      "hidden": false
    },
    {
      "id": "ph-cekura-bench-2026-10-09",
      "title": "Cekura Bench",
      "summary": "Runs 9 realtime voice models, including GPT Realtime 2.1, Gemini Live and Grok, as phone agents across 82 live-call scenarios, ranking reliability, accuracy, latency and cost with public transcripts.",
      "url": "https://benchmarks.cekura.ai/speech-to-speech",
      "source": "producthunt",
      "source_url": "https://www.producthunt.com/products/vocera",
      "category": "launches",
      "tags": [
        "Benchmark",
        "Voice / Speech",
        "Eval"
      ],
      "image": {
        "type": "logo",
        "url": "https://ph-files.imgix.net/950853db-cd69-4dbb-bc94-71f8a62ff4f3.png?auto=format"
      },
      "signals": {
        "upvotes": 159,
        "comments": 17
      },
      "published_at": "2026-10-08T07:01:00Z",
      "hidden": false
    },
    {
      "id": "ph-chickytutor-4-2026-10-09",
      "title": "ChickyTutor",
      "summary": "Spoken AI language tutor that adds an interactive whiteboard for patterns and exercises mid-conversation, a hybrid French course with L'école de français, and an Android app.",
      "url": "https://chickytutor.com",
      "source": "producthunt",
      "source_url": "https://www.producthunt.com/products/chickytutor",
      "category": "launches",
      "tags": [
        "Voice / Speech",
        "Launch"
      ],
      "image": {
        "type": "logo",
        "url": "https://ph-files.imgix.net/f5524dc2-52e8-4d42-be52-bf0ab5ad1733.png?auto=format"
      },
      "signals": {
        "upvotes": 124,
        "comments": 28
      },
      "published_at": "2026-10-08T07:01:00Z",
      "hidden": false
    },
    {
      "id": "gh-diagram-design-2026-10-09",
      "title": "cathrynlavery/diagram-design",
      "summary": "A diagram skill for Claude Code, Codex, Copilot, Factory Droid and Pi that renders 42 editorial diagram types as self-contained HTML and SVG instead of Mermaid.",
      "url": "https://github.com/cathrynlavery/diagram-design",
      "source": "github",
      "source_url": "https://github.com/cathrynlavery/diagram-design",
      "category": "repos",
      "tags": [
        "Dev Tool",
        "Agents",
        "Claude Code"
      ],
      "image": {
        "type": "avatar",
        "url": "https://github.com/cathrynlavery.png?size=80"
      },
      "signals": {
        "stars": 46978,
        "stars_gained": 1160,
        "forks": 2985
      },
      "meta": {
        "language": "HTML"
      },
      "hidden": false
    },
    {
      "id": "gh-claude-mem-2026-10-09",
      "title": "thedotmack/claude-mem",
      "summary": "TypeScript memory layer that records agent sessions, compresses them with an LLM, and injects the relevant context into later sessions across Claude Code, Codex, Gemini, Copilot and others.",
      "url": "https://github.com/thedotmack/claude-mem",
      "source": "github",
      "source_url": "https://github.com/thedotmack/claude-mem",
      "category": "repos",
      "tags": [
        "Dev Tool",
        "Agents",
        "Claude Code"
      ],
      "image": {
        "type": "avatar",
        "url": "https://github.com/thedotmack.png?size=80"
      },
      "signals": {
        "stars": 98744,
        "stars_gained": 670,
        "forks": 8656
      },
      "meta": {
        "language": "TypeScript"
      },
      "hidden": false
    },
    {
      "id": "gh-knowledge-work-plugins-2026-10-09",
      "title": "anthropics/knowledge-work-plugins",
      "summary": "Anthropic's open source collection of Python plugins for Claude Cowork, aimed at knowledge workers rather than developers.",
      "url": "https://github.com/anthropics/knowledge-work-plugins",
      "source": "github",
      "source_url": "https://github.com/anthropics/knowledge-work-plugins",
      "category": "repos",
      "tags": [
        "Open Source",
        "Agents",
        "Anthropic"
      ],
      "image": {
        "type": "avatar",
        "url": "https://github.com/anthropics.png?size=80"
      },
      "signals": {
        "stars": 27873,
        "stars_gained": 392,
        "forks": 3225
      },
      "meta": {
        "language": "Python"
      },
      "hidden": false
    },
    {
      "id": "tc-naturas-99-smart-ring-puts-ai-agents-on-your-2026-10-09",
      "title": "Natura’s $99 smart ring puts AI agents on your finger",
      "summary": "The Interface ring triggers AI agents with a finger press to run tasks, capture notes and control devices, and also works as a health tracker.",
      "url": "https://techcrunch.com/2026/10/08/naturas-smart-ring-puts-ai-agents-on-your-finger/",
      "source": "techcrunch",
      "source_url": "https://techcrunch.com/2026/10/08/naturas-smart-ring-puts-ai-agents-on-your-finger/",
      "category": "news",
      "tags": [
        "Agents",
        "Launch"
      ],
      "image": {
        "type": "thumbnail",
        "url": "https://techcrunch.com/wp-content/uploads/2026/10/interface-workshop-detail.jpg?resize=1200,491"
      },
      "meta": {
        "author": "Aisha Malik",
        "reading_time": "5 minutes"
      },
      "published_at": "2026-10-08T16:00:00Z",
      "hidden": false
    },
    {
      "id": "tc-anthropic-changes-usage-policy-to-ban-model-2026-10-09",
      "title": "Anthropic changes usage policy to ban model abuse and election interference",
      "summary": "The abuse rule targets repeated extreme cases while still allowing ordinary frustration and criticism; the update also covers deceptive campaigns, weapons software, and surveillance.",
      "url": "https://techcrunch.com/2026/10/08/anthropic-changes-usage-policy-to-ban-model-abuse-and-election-interference/",
      "source": "techcrunch",
      "source_url": "https://techcrunch.com/2026/10/08/anthropic-changes-usage-policy-to-ban-model-abuse-and-election-interference/",
      "category": "news",
      "tags": [
        "Anthropic",
        "Policy"
      ],
      "image": {
        "type": "thumbnail",
        "url": "https://techcrunch.com/wp-content/uploads/2026/09/GettyImages-2294192768.jpg?resize=1200,798"
      },
      "meta": {
        "author": "Russell Brandom",
        "reading_time": "2 minutes"
      },
      "published_at": "2026-10-08T18:16:24Z",
      "hidden": false
    },
    {
      "id": "tc-google-releases-a-new-local-first-granola-2026-10-09",
      "title": "Google releases a new local-first Granola competitor",
      "summary": "Google's AI Edge Foresight app transcribes meetings, writes notes, and answers questions about them entirely on-device, with no connection required.",
      "url": "https://techcrunch.com/2026/10/08/google-releases-a-new-local-first-granola-competitor/",
      "source": "techcrunch",
      "source_url": "https://techcrunch.com/2026/10/08/google-releases-a-new-local-first-granola-competitor/",
      "category": "news",
      "tags": [
        "Local LLM",
        "Voice / Speech",
        "Google",
        "Launch"
      ],
      "image": {
        "type": "thumbnail",
        "url": "https://techcrunch.com/wp-content/uploads/2026/06/google-logo.jpg?resize=1200,800"
      },
      "meta": {
        "author": "Ivan Mehta",
        "reading_time": "2 minutes"
      },
      "published_at": "2026-10-08T13:28:39Z",
      "hidden": false
    },
    {